{
  "contractVersion": "1.0.0",
  "validator": {
    "name": "check-adapter-upgrade",
    "version": "0.2.1"
  },
  "invocation": {
    "id": "example-unsafe-upgrade-001",
    "timestamp": "2026-06-14T12:02:00Z"
  },
  "beforeProject": {
    "reference": "before",
    "declarationStatus": "present",
    "validationStatus": "pass"
  },
  "afterProject": {
    "reference": "after",
    "declarationStatus": "present",
    "validationStatus": "fail"
  },
  "coreVersions": {
    "before": "0.2.0",
    "after": "0.2.1"
  },
  "adapterIds": [
    "fixture-upgrade-adapter"
  ],
  "adapterVersions": {
    "before": [
      {
        "adapterId": "fixture-upgrade-adapter",
        "version": "1.0.0"
      }
    ],
    "after": [
      {
        "adapterId": "fixture-upgrade-adapter",
        "version": "1.0.0"
      }
    ]
  },
  "adapterSchemaVersions": {
    "before": "1.0.0",
    "after": "1.0.0"
  },
  "supportedSkillIds": {
    "before": [
      "repo-map"
    ],
    "after": [
      "repo-map"
    ]
  },
  "skillCompatibility": {
    "before": [
      {
        "adapterId": "fixture-upgrade-adapter",
        "skillId": "repo-map",
        "versions": [
          "0.2.0"
        ],
        "mode": "audit-only"
      }
    ],
    "after": []
  },
  "pinStatus": {
    "before": "0.2.0",
    "after": "0.2.1",
    "result": "accepted",
    "staleClassification": "none"
  },
  "compatibilityResult": {
    "result": "fail",
    "codes": [
      "adapter-set-drift",
      "after-project-invalid",
      "restriction-weakening"
    ]
  },
  "restrictionInheritanceResult": {
    "result": "fail",
    "codes": [
      "restriction-weakening"
    ]
  },
  "approvalRequirements": [],
  "detectedRisks": [
    {
      "code": "adapter-set-drift",
      "summary": "The installed adapter set changed across revisions."
    },
    {
      "code": "after-project-invalid",
      "summary": "The proposed project revision did not validate."
    },
    {
      "code": "restriction-weakening",
      "summary": "Inherited restrictions were weakened."
    }
  ],
  "blockingFailures": [
    {
      "code": "adapter-set-drift",
      "summary": "The installed adapter set changed across revisions."
    },
    {
      "code": "after-project-invalid",
      "summary": "The proposed project revision did not validate."
    },
    {
      "code": "restriction-weakening",
      "summary": "Inherited restrictions were weakened."
    }
  ],
  "warnings": [],
  "safeSummary": "The read-only compatibility check rejected 3 condition(s).",
  "finalStatus": "fail",
  "confidence": {
    "level": "high",
    "reason": "Both sanitized revision summaries and compatibility results were available."
  },
  "changedState": {
    "changed": false,
    "summary": "No project, adapter, Git, runtime, service, database, or remote state was changed."
  },
  "recommendedNextAction": "Resolve every blocking failure and rerun the read-only validation."
}
