{
  "contractVersion": "1.0.0",
  "validator": {
    "name": "check-adapter-upgrade-chain",
    "version": "0.2.2"
  },
  "invocation": {
    "id": "example-chain-pass-001",
    "timestamp": "2026-06-14T12:03:00Z"
  },
  "beforeProject": {
    "reference": "before",
    "declarationStatus": "present",
    "validationStatus": "pass"
  },
  "afterProject": {
    "reference": "after",
    "declarationStatus": "present",
    "validationStatus": "pass"
  },
  "coreVersions": {
    "before": "0.1.4",
    "after": "0.2.2"
  },
  "adapterIds": [
    "fixture-chain-adapter"
  ],
  "adapterVersions": {
    "before": [
      {
        "adapterId": "fixture-chain-adapter",
        "version": "1.0.0"
      }
    ],
    "after": [
      {
        "adapterId": "fixture-chain-adapter",
        "version": "1.0.0"
      }
    ]
  },
  "adapterSchemaVersions": {
    "before": "1.0.0",
    "after": "1.0.0"
  },
  "supportedSkillIds": {
    "before": [
      "repo-map"
    ],
    "after": [
      "repo-map"
    ]
  },
  "skillCompatibility": {
    "before": [
      {
        "adapterId": "fixture-chain-adapter",
        "skillId": "repo-map",
        "versions": [
          "0.1.4"
        ],
        "mode": "audit-only"
      }
    ],
    "after": [
      {
        "adapterId": "fixture-chain-adapter",
        "skillId": "repo-map",
        "versions": [
          "0.2.2"
        ],
        "mode": "audit-only"
      }
    ]
  },
  "pinStatus": {
    "before": "0.1.4",
    "after": "0.2.2",
    "result": "accepted",
    "staleClassification": "none"
  },
  "compatibilityResult": {
    "result": "pass",
    "codes": []
  },
  "restrictionInheritanceResult": {
    "result": "pass",
    "codes": []
  },
  "approvalRequirements": [],
  "detectedRisks": [],
  "blockingFailures": [],
  "warnings": [],
  "safeSummary": "The read-only compatibility check passed without applying changes.",
  "finalStatus": "pass",
  "confidence": {
    "level": "high",
    "reason": "Both sanitized revision summaries and compatibility results were available."
  },
  "changedState": {
    "changed": false,
    "summary": "No project, adapter, Git, runtime, service, database, or remote state was changed."
  },
  "recommendedNextAction": "Request human approval before adopting this upgrade in a real project.",
  "chainId": "example-safe-chain",
  "chainSummary": {
    "revisionCount": 5,
    "transitionCount": 4,
    "passedTransitions": 4,
    "failedTransitions": 0,
    "steps": [
      {
        "stepIndex": 1,
        "beforeRevision": "revision-1",
        "afterRevision": "revision-2",
        "status": "pass",
        "codes": []
      },
      {
        "stepIndex": 2,
        "beforeRevision": "revision-2",
        "afterRevision": "revision-3",
        "status": "pass",
        "codes": []
      },
      {
        "stepIndex": 3,
        "beforeRevision": "revision-3",
        "afterRevision": "revision-4",
        "status": "pass",
        "codes": []
      },
      {
        "stepIndex": 4,
        "beforeRevision": "revision-4",
        "afterRevision": "revision-5",
        "status": "pass",
        "codes": []
      }
    ]
  }
}
